INF263,Algoritmia,4,20239927.3,PATINO MEZA MANUEL,20239103.4,LEE VASQUEZ JENNY,20238383.3,GORDILLO BOLANOS ARTURO GONZALO,20238320.5,NORABUENA RIVERA GLORIA YESSICA,20238318.1,TOKESHI GONZALES MARTIN,20238072.3,RIVERA MONTERO GLORIA OFELIA,20236517.2,ZEGARRA CUBA ANTONIO,20236015.3,ALFARO FUENTES MAGDA,20235763.2,CORREA AGUIRRE MOISES,20235724.4,VEGA SAENZ ALEXANDER RICHARD
1INF13,Analisis de Datos,4,20236517.2,ZEGARRA CUBA ANTONIO,20236015.3,ALFARO FUENTES MAGDA,20235763.2,CORREA AGUIRRE MOISES,20235724.4,VEGA SAENZ ALEXANDER RICHARD,20235643.2,IBEROS ZAMBRANO GONZALO,20235527.3,JUSTINO COLLADO LUZ DELICIA,20235318.3,FLORENCIO LAM PAUL RONALD,20234919.5,CORTES CALIXTO ROSARIO,20233754.3,MALCA SAAVEDRA DORIS MILAGROS,20233627.1,CHAVEZ CARO YVONNE,20233249.3,NORABUENA PAIRAZAMAN JULIAN,20233122.2,CUBA NARVAEZ PAUL JOHN,20233065.2,RETT SERRANO RAFAEL RHONY,20232501.2,CORTES REYES MARIBEL,20232360.5,VILCA BARRERA CESAR EDGAR
INF144,Tecnicas de Programacion,5,20225067.4,JAUREGUI AGUERO HECTOR HENRY,20224918.5,PORTUGAL GUEVARA HELI JOHANA,20224712.2,CASANOVA CHUMPITAZ ALONSO,20224628.5,PALOMARES GUEVARA KARINA,20224569.5,RIVERA PASQUEL OFELIA CINTHIA
MAT241,Metodos Numericos En Ingenieria,3,20216963.4,CORTEZ LEIVA SURAMI SILVIA,20216490.2,TAVERA CORREA FERNANDO,20216038.4,SAONA ARIAS ALBERTO,20215802.5,MINAYA AMEZQUITA RHONY JAIME,20215775.3,PRADO PAREDES JUAN,20215607.2,POZO JUGO ISABEL,20215400.1,SANTISTEBAN JUGO NESTOR,20214739.4,VELASQUEZ CANO FERNANDO,20214285.2,CHAVARRI ALDAVE FERNANDO MARTIN,20213758.1,SOMA INGA DIALY,20213703.5,GAMARRA TABORI PAUL RONAL,20213402.1,VIZCARDO MORI LUCERO ZKENIA,20213373.3,ESCALANTE RARAZ BLANCA,20213223.4,DIAZ SEDANO YVONNE,20212887.2,CABRERA AGUERO JESSICA,20212742.5,ZAVALETA LOPEZ KARIN VIRGINIA,20212598.1,MORI ZAVALETA LUZ LOURDES,20211791.1,GONZALES VELASQUEZ WALTER,20211397.2,ZEVALLOS PRADO RICARDO,20211260.2,GORDILLO CASTRO RONAL
INF281,Lenguajes de Programacion 1,5,20235643.2,IBEROS ZAMBRANO GONZALO,20235527.3,JUSTINO COLLADO LUZ DELICIA,20235318.3,FLORENCIO LAM PAUL RONALD,20234919.5,CORTES CALIXTO ROSARIO,20233754.3,MALCA SAAVEDRA DORIS MILAGROS,20233627.1,CHAVEZ CARO YVONNE,20233249.3,NORABUENA PAIRAZAMAN JULIAN,20233122.2,CUBA NARVAEZ PAUL JOHN,20233065.2,RETT SERRANO RAFAEL RHONY,20232501.2,CORTES REYES MARIBEL
INF246,Bases De Datos,2,20238320.5,NORABUENA RIVERA GLORIA YESSICA,20238318.1,TOKESHI GONZALES MARTIN,20238072.3,RIVERA MONTERO GLORIA OFELIA,20236517.2,ZEGARRA CUBA ANTONIO,20236015.3,ALFARO FUENTES MAGDA,20235763.2,CORREA AGUIRRE MOISES,20235724.4,VEGA SAENZ ALEXANDER RICHARD,20235643.2,IBEROS ZAMBRANO GONZALO,20235527.3,JUSTINO COLLADO LUZ DELICIA,20235318.3,FLORENCIO LAM PAUL RONALD,20234919.5,CORTES CALIXTO ROSARIO,20233754.3,MALCA SAAVEDRA DORIS MILAGROS,20233627.1,CHAVEZ CARO YVONNE,20233249.3,NORABUENA PAIRAZAMAN JULIAN,20233122.2,CUBA NARVAEZ PAUL JOHN,20233065.2,RETT SERRANO RAFAEL RHONY,20232501.2,CORTES REYES MARIBEL,20232360.5,VILCA BARRERA CESAR EDGAR,20232050.4,LOYOLA HIJAR NICOLAS OSCAR,20232000.4,LANDA CUEVA JOHAN,20231748.4,PATINO FUENTES MILAGROS MARIELLA,20231247.5,SERRANO JOLAY RHONY ROLANDO,20229773.5,SANCHEZ CUBA NATALIA ESTEFANIA,20229437.4,ZIMIC PAREDES SHIRLEY,20227316.2,RIVERO RETT RONY ANTONIO